[
 {"statement":"Il faut freeze la vague devant sa tour quand on est en retard de niveau","explanation":"Ça force l'adversaire à venir loin de sa tour, où il devient vulnérable au gank.","type":"regle","domain":"wave","subdomain":"freeze","roles":["tous"],"phases":["early"],"conditions":["soloQ jusqu'à Émeraude","adversaire qui ne track pas la jungle"],"level":2,"anchors":["[kirei-001@00:00]"],"quote":"il faut toujours freeze la vague devant sa tour quand on est en retard de niveau","confidence":"explicite","prereq_hint":["états de vague"]},
 {"statement":"Push la vague sans raison juste avant un dragon est une erreur fréquente","explanation":"","type":"erreur","domain":"wave","subdomain":"tempo_wave","roles":["tous"],"phases":["mid"],"conditions":[],"level":2,"anchors":["[kirei-001@00:00]"],"quote":"les gens push la vague sans raison juste avant le dragon","confidence":"explicite","prereq_hint":[]},
 {"statement":"Il faut crash la vague 30 secondes avant l'objectif, pas la push","explanation":"","type":"seuil","domain":"wave","subdomain":"tempo_wave","roles":["tous"],"phases":["mid"],"conditions":[],"level":2,"anchors":["[kirei-001@00:00]"],"quote":"crash la vague 30 secondes avant l'objectif","confidence":"explicite","prereq_hint":[]},
 {"statement":"Faire dix parties custom en ne faisant que du last hit, sans jamais toucher la vague autrement","explanation":"","type":"exercice","domain":"fondamentaux","subdomain":"cs","roles":["tous"],"phases":["toutes"],"conditions":[],"level":1,"anchors":["[kirei-001@00:00]"],"quote":"faites dix parties custom","confidence":"explicite","prereq_hint":[]},
 {"statement":"Poser un ward dans le buff adverse à 1 minute 30, timing de passage du jungler","explanation":"","type":"seuil","domain":"vision","subdomain":"placement","roles":["tous"],"phases":["early"],"conditions":[],"level":2,"anchors":["[kirei-001@01:03]"],"quote":"un ward dans le buff adverse à 1 minute 30","confidence":"explicite","prereq_hint":[]}
]
